<?xml version="1.0"?>
<!DOCTYPE baat SYSTEM "http://ccg.murdoch.edu.au/dtd/baat.dtd">
<baat>
  <job toolPath="/usr/local/grendel/bin/blastpgpWrapper" toolName="blastpgp" displayName="blastpgp" description="Blastpgp is part of the BLAST software package from the NCBI that performs gapped blastp searches, and can also be used to perform iterative searches in psi-blast and phi-blast mode. Blastpgp requires a protein fasta">

    <inputFile/>
    <outputFile/>

    <inputFiletypes requiresInput="true" acceptsInput="true">
        <extension>fa</extension>
        <extension>fna</extension>
        <extension>faa</extension>
        <extension>seq</extension>
    </inputFiletypes>

    <outputFiletypes filePassThru="false">
        <extension>bls</extension>
    </outputFiletypes>

    <parameterList>
      <parameter rank=""  switchUse="both"       switch="-A" mandatory="no"  inputFile="no"    outputFile="no"  value="" />
      <parameter rank=""  switchUse="both"       switch="-B" mandatory="no"  inputFile="yes"   outputFile="no"  value="" />
      <parameter rank=""  switchUse="both"       switch="-C" mandatory="no"  inputFile="yes"   outputFile="no"  value="" />
      <parameter rank=""  switchUse="both"       switch="-E" mandatory="no"  inputFile="no"    outputFile="no"  value="" />
      <parameter rank=""  switchUse="both"       switch="-F" mandatory="no"  inputFile="no"    outputFile="no"  value="" />
      <parameter rank=""  switchUse="both"       switch="-G" mandatory="no"  inputFile="no"    outputFile="no"  value="" />
      <parameter rank=""  switchUse="both"       switch="-H" mandatory="no"  inputFile="no"    outputFile="no"  value="" />
      <parameter rank=""  switchUse="switchOnly" switch="-I" mandatory="no"  inputFile="no"    outputFile="no"  value="" />
      <parameter rank=""  switchUse="switchOnly" switch="-J" mandatory="no"  inputFile="no"    outputFile="no"  value="" />
      <parameter rank=""  switchUse="both"       switch="-K" mandatory="no"  inputFile="no"    outputFile="no"  value="" />
      <parameter rank=""  switchUse="both"       switch="-L" mandatory="no"  inputFile="no"    outputFile="no"  value="" />
      <parameter rank=""  switchUse="both"       switch="-M" mandatory="no"  inputFile="no"    outputFile="no"  value="" />
      <parameter rank=""  switchUse="both"       switch="-N" mandatory="no"  inputFile="no"    outputFile="no"  value="" />
      <parameter rank=""  switchUse="both"       switch="-O" mandatory="no"  inputFile="yes"   outputFile="no"  value="" />
      <parameter rank=""  switchUse="both"       switch="-P" mandatory="no"  inputFile="no"    outputFile="no"  value="" />
      <parameter rank=""  switchUse="both"       switch="-Q" mandatory="no"  inputFile="yes"   outputFile="no"  value="" />
      <parameter rank=""  switchUse="both"       switch="-R" mandatory="no"  inputFile="yes"   outputFile="no"  value="" />
      <parameter rank=""  switchUse="both"       switch="-S" mandatory="no"  inputFile="no"    outputFile="no"  value="" />
      <parameter rank=""  switchUse="switchOnly" switch="-T" mandatory="no"  inputFile="no"    outputFile="no"  value="" />
      <parameter rank=""  switchUse="switchOnly" switch="-U" mandatory="no"  inputFile="no"    outputFile="no"  value="" />
      <parameter rank=""  switchUse="both"       switch="-W" mandatory="no"  inputFile="no"    outputFile="no"  value="" />
      <parameter rank=""  switchUse="both"       switch="-X" mandatory="no"  inputFile="no"    outputFile="no"  value="" />
      <parameter rank=""  switchUse="both"       switch="-Y" mandatory="no"  inputFile="no"    outputFile="no"  value="" />
      <parameter rank=""  switchUse="both"       switch="-Z" mandatory="no"  inputFile="no"    outputFile="no"  value="" />
      <parameter rank=""  switchUse="both"       switch="-a" mandatory="no"  inputFile="no"    outputFile="no"  value="" />
      <parameter rank=""  switchUse="both"       switch="-b" mandatory="no"  inputFile="no"    outputFile="no"  value="" />
      <parameter rank=""  switchUse="both"       switch="-c" mandatory="no"  inputFile="no"    outputFile="no"  value="" />
      <parameter rank=""  switchUse="both"       switch="-d" mandatory="no"  inputFile="no"    outputFile="no"  value="" />
      <parameter rank=""  switchUse="both"       switch="-e" mandatory="no"  inputFile="no"    outputFile="no"  value="" />
      <parameter rank=""  switchUse="both"       switch="-f" mandatory="no"  inputFile="no"    outputFile="no"  value="" />
      <parameter rank=""  switchUse="both"       switch="-g" mandatory="no"  inputFile="no"    outputFile="no"  value="" />
      <parameter rank=""  switchUse="both"       switch="-h" mandatory="no"  inputFile="no"    outputFile="no"  value="" />
      <parameter rank=""  switchUse="both"       switch="-i" mandatory="yes" inputFile="yes"   outputFile="no"  value="" />
      <parameter rank=""  switchUse="both"       switch="-j" mandatory="no"  inputFile="no"    outputFile="no"  value="" />
      <parameter rank=""  switchUse="both"       switch="-k" mandatory="no"  inputFile="yes"   outputFile="no"  value="" />
      <parameter rank=""  switchUse="both"       switch="-l" mandatory="no"  inputFile="maybe" outputFile="no"  value="" />
      <parameter rank=""  switchUse="both"       switch="-m" mandatory="no"  inputFile="no"    outputFile="no"  value="" />
      <parameter rank=""  switchUse="both"       switch="-o" mandatory="no"  inputFile="no"    outputFile="yes" value="" />
      <parameter rank=""  switchUse="both"       switch="-p" mandatory="no"  inputFile="no"    outputFile="no"  value="" />
      <parameter rank=""  switchUse="switchOnly" switch="-s" mandatory="no"  inputFile="no"    outputFile="no"  value="" />
      <parameter rank=""  switchUse="both"       switch="-t" mandatory="no"  inputFile="no"    outputFile="no"  value="" />
      <parameter rank=""  switchUse="both"       switch="-v" mandatory="no"  inputFile="no"    outputFile="no"  value="" />
      <parameter rank=""  switchUse="both"       switch="-y" mandatory="no"  inputFile="no"    outputFile="no"  value="" />
      <parameter rank=""  switchUse="both"       switch="-z" mandatory="no"  inputFile="no"    outputFile="no"  value="" />
    </parameterList>

    <parameterAliasList/>

    <grendel/>
    <priority/>
    <executionHost/>
    <batchNumber/>
    <status/>
    <startTime/>
    <stopTime/>
    <submittedTime/>
    <submitUser/>
    <submitLabel/>
  </job>
</baat>
