<?xml version='1.0'?>
<!DOCTYPE baat SYSTEM 'http://cbbc.murdoch.edu.au/dtd/baat.dtd'>
<baat>
  <job toolPath='/usr/local/bin/blastall' toolName='blast'>

    <inputFile>data.zip</inputFile>
    <outputFile>1234567890.zip</outputFile>

    <parameterList>
      <parameter name='dataset' mandatory='Yes' switchOnly='No' switch='-d' value='nr' rank='1'/>
      <parameter name='dataset' mandatory='Yes' switchOnly='No' switch='-p' value='blastx' rank='2'/>
      <parameter name='dataset' mandatory='Yes' switchOnly='No' switch='-i' value='data.txt' rank='3'/>
      <parameter name='dataset' mandatory='Yes' switchOnly='No' switch='-d' value='nr' rank='4'/>
      <parameter name='dataset' mandatory='Yes' switchOnly='No' switch='-d' value='nr' rank='5'/>
      <parameter name='dataset' mandatory='Yes' switchOnly='No' switch='-d' value='nr' rank='6'/>
    </parameterList>

    <grendel id='1234567'>
      <option>
        <name>eric</name>
      </option>
      <option>
        <name>cache</name>
      </option>
      <option>
        <name>label</name>
        <value>igrow</value>
      </option>
    </grendel>

    <priority>-20</priority>
    <executionHost>cbbc-n09</executionHost>
    <batchNumber>1234567890</batchNumber>
    <status>C</status>
    <startTime>13 oct 2003 12:00:01</startTime>
    <stopTime>13 oct 2003 12:00:02</stopTime>
    <submittedTime>13 oct 2003 12:00:00</submittedTime>
    <submitUser>some user</submitUser>
    <submitLabel>some_random_label</submitLabel>
  </job>

</baat>
