<?xml version="1.0"?>
<!DOCTYPE baat SYSTEM "http://ccg.murdoch.edu.au/dtd/baat.dtd">
<baat>
  <job toolPath="/bin/echo" toolName="echo">

    <inputFile/>
    <outputFile/>

    <parameterList>
        <parameter rank="1" switchUse="valueOnly" switch="text" mandatory="no" inputFile="no" outputFile="no"  value=""/>
    </parameterList>

    <parameterAliasList/>

    <grendel/>
    <priority/>
    <executionHost/>
    <batchNumber/>
    <status/>
    <startTime/>
    <stopTime/>
    <submittedTime/>
    <submitUser/>
    <submitLabel/>
  </job>
</baat>
