<?xml version="1.0"?>
<!DOCTYPE baat SYSTEM "http://ccg.murdoch.edu.au/dtd/baat.dtd">
<baat>
  <job toolPath="/usr/local/bin/ccg-fetchkeggid" toolName="getkeggid" displayName="get KEGG id" description="Retrieves KEGG ids from GeneID or GI. This tool only accepts and produces yabixml for use with other Yabi tools.">

    <inputFile/>
    <outputFile/>

    <inputFiletypes requiresInput="true" acceptsInput="true">
        <extension>xml</extension>
    </inputFiletypes>

    <outputFiletypes filePassThru="false">
        <extension>xml</extension>
    </outputFiletypes>

    <parameterList>
      <parameter rank="1" switchUse="valueOnly" switch="inputFiles" mandatory="yes" inputFile="yes" outputFile="no" value=""/>
    </parameterList>

    <parameterAliasList/>

    <grendel/>
    <priority/>
    <executionHost/>
    <batchNumber/>
    <status/>
    <startTime/>
    <stopTime/>
    <submittedTime/>
    <submitUser/>
    <submitLabel/>
  </job>
</baat>
